<?xml version="1.0" encoding="ISO-8859-1"?>

<!DOCTYPE component SYSTEM "dtds/component.dtd">

<component name="Course">

	<entity>
		<property name="year" type="int" size="4" key="true"/>
		<property name="number" type="int" key="true" size="5" hidden="true">
			<default-value-calculator on-create="true"
				class="org.openxava.test.calculators.CourseNumberCalculator"/>
		</property>
		<property name="description" type="String" required="true"/>
	</entity>
	
	<entity-mapping table="XAVATEST.COURSE">
		<property-mapping property="year" column="YEAR"/>
		<property-mapping property="number" column="NUMBER"/>
		<property-mapping property="description" column="DESCRIPTION"/>
	</entity-mapping>	
	
</component>