<?xml version="1.0" encoding="UTF-8"?>

<!DOCTYPE component SYSTEM "dtds/component.dtd">

<!-- 
	A warehouse version with code generated by OpenXava
	-->

<component name="Warehouse2">

	<entity>
		<property name="zoneNumber" key="true"
			size="3" required="true" type="int"/>   			
		<property name="number" key="true"
			size="3" required="true" type="int"/>   
		<property name="name" type="String"
			size="40" required="true"/>
	</entity>
				
	<entity-mapping table="XAVATEST@separator@WAREHOUSE">
		<property-mapping 
			property="zoneNumber" column="ZONE"/>	
		<property-mapping 
			property="number" column="NUMBER"  cmp-type="Integer">
			<converter class="org.openxava.converters.IntegerNumberConverter"/>						
		</property-mapping>
		<property-mapping
			property="name" column="NAME"/>
	</entity-mapping> 
	
</component>