<?xml version="1.0" encoding="ISO-8859-1"?>

<!DOCTYPE component SYSTEM "dtds/component.dtd">

<component name="ServiceInvoice">

	<entity>
		<property name="oid" type="String" key="true" hidden="true">
			<default-value-calculator class="org.openxava.calculators.UUIDCalculator" on-create="true"/>
		</property>
		<property name="year" type="int" search-key="true" size="4">
			<default-value-calculator class="org.openxava.calculators.CurrentYearCalculator"/>	
		</property>		
		<property name="number" type="int" search-key="true" size="6"/>		
		<property name="description" stereotype="MEMO"/>		
		<property name="amount" stereotype="MONEY"/>
	</entity>
	
	
	<view members="year, number, amount; description"/>
	
	<tab >
		<properties>year, number, description, amount+</properties>
	</tab>
	
	<!-- 
	Do not put here a mapping, 
	because this entity is for testing default mapping  
	-->
													
</component>