<?xml version="1.0" encoding="ISO-8859-1"?>

<!DOCTYPE component SYSTEM "dtds/component.dtd">

<component name="City">

	<entity>
		<reference name="state" key="true" required="true"/>
		<property name="code" type="String" key="true" size="5" required="true"/>
		<property name="name" type="String" 
			size="20" required="true"/>
	</entity>
	
	<entity-mapping table="XAVATEST@separator@CITY">
		<reference-mapping reference="state">
			<reference-mapping-detail column="STATE" referenced-model-property="id"/>
		</reference-mapping>
		<property-mapping property="code" column="ID"/>
		<property-mapping property="name" column="NAME"/>
	</entity-mapping> 
				
</component>