<?xml version="1.0" encoding="ISO-8859-1"?>

<!DOCTYPE component SYSTEM "dtds/component.dtd">

<!-- 
Number (the key) can be 0
 -->

<component name="Color">

	<entity>
		<property name="number" type="Integer" key="true" size="5" required="false">
			<default-value-calculator class="org.openxava.calculators.IdentityCalculator" on-create="true"/>
		</property>
		<property name="name" type="String"	size="20" required="true"/>
		<property name="version" type="int" version="true"/>	
		<property name="sample" stereotype="IMAGE_LABEL">	
			<calculator class="org.openxava.test.calculators.ColorSampleCalculator">
				<set property="colorName" from="name"/>
			</calculator>
		</property>
	</entity>
		
	<view name="View1">
		<property name="property1" type="String"/>
		<members>property1</members>
	</view>
	
	<view name="View2">
		<property name="property2" type="String"/>
		<members>property2</members>
	</view>
	
	<view name="View2Sub1">
		<property name="property2Sub1" type="String"/>
		<members>property2Sub1</members>
	</view>
	
	<view name="View2Sub2">
		<property name="property2Sub2" type="String"/>
		<members>property2Sub2</members>
	</view>
	
	<view name="Groups">
		<property name="property1" type="String"/>
		<property name="property2" type="String"/>
		<property name="group">
			<valid-values>
				<valid-value value="GROUP1"/>
				<valid-value value="GROUP2"/>
			</valid-values>
		</property>
		<property-view property="group">
			<on-change class="org.openxava.test.actions.OnChangeGroupInColorAction"/>
		</property-view>
		
		<members>
			group; 
			<group name="group1">property1</group>,
			<group name="group2">property2</group> 
		</members>
	</view>

	<view name="Ordinary">
		<members>number; name; sample</members>
	</view>
	
	<entity-mapping table="XAVATEST.COLOR">
		<property-mapping
			property="number" column="NUMBER"/>
		<property-mapping
			property="name" column="NAME"/>
		<property-mapping
			property="version" column="VERSION"/>					
	</entity-mapping> 
				
</component>