<?xml version="1.0" encoding="ISO-8859-1"?>

<!DOCTYPE component SYSTEM "dtds/component.dtd">

<component name="SubjectGroup">

	<entity>
		<reference name="quarterSubject" key="true"/>
		<property name="code" type="String" key="true" size="10"/>
		<property name="type" type="String" size="10"/>
	</entity>
	
	<view>
		<reference-view reference="quarterSubject">
			<descriptions-list/>
		</reference-view>		
	</view>
			
</component>