<?xml version="1.0" encoding="ISO-8859-1"?>

<!DOCTYPE component SYSTEM "dtds/component.dtd">

<!-- 
This is only for testing a single reference as key, 
but remember this is not an example of good OO modeling.
 -->

<component name="CustomerContactPerson">

	<entity>
		<reference name="customer" key="true"/>
		<property name="name" stereotype="PERSON_NAME" required="true"/>	
	</entity>

	<view>
		<reference-view reference="customer" view="Simple"/>
	</view>
			
	<entity-mapping table="XAVATEST@separator@CUSTOMERCONTACTPERSON">
		<reference-mapping reference="customer">
			<reference-mapping-detail 
				column="CUSTOMER_NUMBER" 				
				referenced-model-property="number"/> 
		</reference-mapping>			
		<property-mapping
			property="name" column="NAME"/>
	</entity-mapping> 	
							
</component>