<?xml version="1.0" encoding="ISO-8859-1"?>

<!DOCTYPE component SYSTEM "dtds/component.dtd">

<component name="Ingredient">

	<entity>
		<property name="oid" type="String" key="true" hidden="true">
			<default-value-calculator class="org.openxava.calculators.UUIDCalculator"/>
		</property>
		<property name="name" type="String"
			size="40" required="true"/>			  			
		<reference name="partOf" model="Ingredient"/>
	</entity>
	
	<view>
		<reference-view reference="partOf">
			<descriptions-list/>
		</reference-view>
	</view>
		
	<entity-mapping table="XAVATEST_INGREDIENT">
		<property-mapping
			property="oid" column="ID"/>
		<property-mapping
			property="name" column="NAME"/>
		<reference-mapping reference="partOf">
			<reference-mapping-detail column="PARTOF" referenced-model-property="oid"/>
		</reference-mapping>	
	</entity-mapping> 
						
</component>