<?xml version="1.0" encoding="ISO-8859-1"?>

<!DOCTYPE component SYSTEM "dtds/component.dtd">

<!-- 
This component is mapping to an unqualified table,
ISSUE, without schema, this is for testing the
default schema behaviour
 -->

<component name="Worker">

	<entity>
		<property name="id" type="Integer" key="true" hidden="true"/>
		<property name="nickName" type="String" 
			size="40" required="true"/>		
		<property name="fullName" type="String" 
			size="40" required="true"/>
	</entity>
	
	<entity-mapping table="ISSUE">
		<property-mapping
			property="id" column="ID"/>
		<property-mapping
			property="nickName" column="NICKNAME"/>
		<property-mapping
			property="fullName" column="FULLNAME"/>			
	</entity-mapping>
					
</component>